0051778-INSP-2025.pdf,ESTRN HILLS 4-65 17-18 S,005-1778,11-Dec-24,March 2023,September 2024,B,"Source failed to operate without venting hydrocarbon emissions from the tanks on nine (9) occasions during the compliance period , violating Regulation 7, Part B § II.C.2.a.",9,Occasions,N,design analysis
0051778-INSP-2025.pdf,ESTRN HILLS 4-65 17-18 S,005-1778,11-Dec-24,March 2023,September 2024,C,"Source failed to provide records of pressure readings, violating Regulation 7, Part B §§ II.B.2.f.",,,N,pressure monitoring
0051778-INSP-2025.pdf,ESTRN HILLS 4-65 17-18 S,005-1778,11-Dec-24,March 2023,September 2024,D,"Source did not provide any records of inspections, testing, and/or calibrations, violating Regulation 7, Part B § II.C.4.",,,N,test
0051796-GP10-2026.pdf,Chico-Watkins South,005-1796,23-Oct-25,August 2024,August 2025,A,"The Company failed to design, operate, and maintain its condensate collection, storage, processing, and handling operations so as to minimize the leakage of VOC to the atmosphere to the maximum extent practicable, violating Permit GP10, Condition IV.A.2.",,,N,design analysis
0051796-GP10-2026.pdf,Chico-Watkins South,005-1796,23-Oct-25,August 2024,August 2025,B,"The Company failed to provide a design analysis, predictive analysis, and preventative maintenance records. The Company was unable to demonstrate that the facility was designed properly to prevent over pressurization. The Company failed to operate without venting hydrocarbon emissions from the storage tanks, violating Permit GP10, Condition IV.C.2. See the table below for more details.",12,Days,N,design analysis
0051799-GP10-2026.pdf,Lussing Trust 4-64 19-20 North,005-1799,23-Oct-25,April 2025,September 2025,A,"The Company failed to monitor the weekly catalyst inlet temperature of the two (2) PSI 11.1L engines for eight (8) weeks (7/10/2025 to 8/31/2025), violating Permit GP10, Condition IV.B.5.f.",8,Weeks,N,temperature monitoring
0051799-GP10-2026.pdf,Lussing Trust 4-64 19-20 North,005-1799,23-Oct-25,April 2025,September 2025,B,"The company failed to monitor the pressure drop across the catalyst bed of the two (2) PSI 11.1L engines for two (2) months (7/2025 and 8/2025), violating Permit GP10, Condition IV.B.5.g.",2,Months,N,pressure monitoring
123-1375-INSP-2025 ENF - Dani Serna.pdf,Crestone Peak Resources - Rasmussen 19 (d.b.a. Civitas Resources),123-1375,03-Dec-24,December 2022,November 2024,1,"The company failed to install the flow meter at this facility by this deadline. The operator stated the flow meter was installed and connected to the SCADA system on 1/16/2025. The company failed to install the flow meter at this facility by the deadline of 5/1/2023, violating AQCC Regulation 7, II.B.g(i)(B).",3,Days,N,flow monitoring
123-9C07-INSP-2025.pdf,North Platte K-22 Production Facility,123- 9C07,14-Nov-24,September 2023,September 2024,A,"Source failed to limit emissions to the annual limit of 6.1 tpy of VOC for eleven (11) months during the compliance period. And, Source failed to limit emissions to the annual limit of 1.3 tpy of CO for ten (10) months during the compliance period. See table below for emissions exceedances. 12- month rolling period ending AIRS Point VOC Permitted tpy VOC Actual tpy CO Permitted tpy CO Actual tpy Sept 2023 013 6.1 13.62 1.3 1.91 Oct 2023 013 6.1 13.54 1.3 1.90 Nov 2023 013 6.1 14.25 1.3 2.0 Dec 2023 013 6.1 13.83 1.3 1.94 Jan 2024 013 6.1 13.63 1.3 1.91 Feb 2024 013 6.1 13.14 1.3 1.84 Mar 2024 013 6.1 12.90 1.3 1.81 Apr 2024 013 6.1 12.80 1.3 1.79 May 2024 013 6.1 12.01 1.3 1.68 Jun 2024 013 6.1 10.43 1.3 1.46 Jul 2024 013 6.1 7.9 1.3 In Complia nce Source failed to keep emissions under the appropriate limitations, violating Permit 14WE0494 (6), Condition 3. This non-compliance issue was identified in a previous report (inspection date: November 8, 2023), and the issue was on-going during the compliance period of this report.",11,Months,N,inspections
123-9C07-INSP-2025.pdf,North Platte K-22 Production Facility,123- 9C07,14-Nov-24,September 2023,September 2024,B,"Source failed to limit throughput of Process Parameter 1 for Point 013 for eleven (11) months during the compliance period, demonstrated in the table below. 12-month rolling period ending AIRS Point Gas Vented from LP Separators: Permitted MMscf/yr Gas Vented from LP Separators: Actual MMscf/yr Sept 2023 013 1.5 3.39 Oct 2023 013 1.5 3.37 Nov 2023 013 1.5 3.54 Dec 2023 013 1.5 3.44 Jan 2024 013 1.5 3.39 Feb 2024 013 1.5 3.27 Mar 2024 013 1.5 3.21 Apr 2024 013 1.5 3.18 May 2024 013 1.5 2.98 Jun 2024 013 1.5 2.59 Jul 2024 013 1.5 1.96 Source failed to maintain throughput rates within the appropriate limitations, violating Permit 14WE0494 (6), Condition 6. This non- compliance issue was identified in a previous report (inspection date: November 8, 2023), and the issue was on-going during the compliance period of this report.",11,Months,N,throughput
123-9C07-INSP-2025.pdf,North Platte K-22 Production Facility,123- 9C07,14-Nov-24,September 2023,September 2024,C,"Source failed to perform one (1) periodic performance test, violating Permit GP02, Condition VI.E.4.",,,N,test
123-9D4B Inspection Report 2025.pdf,State Pronghorn 41-32 Central Production Facility,123-9D4B,15-Jan-25,November 2023,December 2024,A,"Source failed to limit NOx emissions from Point 011 to the emission limit for ten (10) months during the compliance period, violating Permit 20OPWE420, Section II, Condition 1.1.",12,Month,N,permit
123-9D4B Inspection Report 2025.pdf,State Pronghorn 41-32 Central Production Facility,123-9D4B,15-Jan-25,November 2023,December 2024,B,"The source failed to provide records of the annual training pr ogram that was implemented in accordance with the Reg 7 requirements. The source failed to develop and implement an annual training program for the storage tank measuring system at the facility, violating Permit 20OPWE420, Section II, Condition 10.8.4.",,,N,permit
123-9D4B Inspection Report 2025.pdf,State Pronghorn 41-32 Central Production Facility,123-9D4B,15-Jan-25,November 2023,December 2024,C,"Source failed to provide records of storage tank measurement inspections for the compliance period, violating 20OPWE420, Section II, Condition 10.8.4.6.",,,N,inspections
123-9D4B Inspection Report 2025.pdf,State Pronghorn 41-32 Central Production Facility,123-9D4B,15-Jan-25,November 2023,December 2024,D,"The source failed to conduct an annual com pliance test for Point 011 in 2023 , violating Permit 20OPWE420, Section II, Condition 1.10.",,,N,test
123-9D4B Inspection Report 2025.pdf,State Pronghorn 41-32 Central Production Facility,123-9D4B,15-Jan-25,November 2023,December 2024,E,"The source failed to submit a permit modification for Point 022 within sixty (60) days to the Division, violating Permit 20OPWE420, Section II, Condition 4.9.6.",60,Days,N,permit
123-9D4B Inspection Report 2025.pdf,State Pronghorn 41-32 Central Production Facility,123-9D4B,15-Jan-25,November 2023,December 2024,F,"The Source failed to submit a permit modification within sixty (60) days of the analysis, violati ng Permit 20OPWE420, Section II, Condition 1.5.",60,Days,N,permit
123-9D4B Inspection Report 2025.pdf,State Pronghorn 41-32 Central Production Facility,123-9D4B,15-Jan-25,November 2023,December 2024,G,"The s ource failed to submit a permit modification within sixty (60) days of the analysis, violating Permit 20OPWE420, Section II, Condition 2.4.",60,Days,N,permit
123-9D4B Inspection Report 2025.pdf,State Pronghorn 41-32 Central Production Facility,123-9D4B,15-Jan-25,November 2023,December 2024,H,"The Source failed to submit a permit modification within sixty (60) days of the analysis, violating Permit 20OPWE420, Section II, Condition 6.5.",60,Days,N,permit
123-9D4B Inspection Report 2025.pdf,State Pronghorn 41-32 Central Production Facility,123-9D4B,15-Jan-25,November 2023,December 2024,I,"The source did not provide records of annual inspections of thief hatch and pressure relief devices, violating Permit 20OPWE420, Section II, Condition 3.7.1.5.",,,N,inspections
123-9D4B Inspection Report 2025.pdf,State Pronghorn 41-32 Central Production Facility,123-9D4B,15-Jan-25,November 2023,December 2024,J,"The source failed to provide records of the gauge pressure recorded for each blowdown event and the twelve -month average gauge pressure at actual conditions calculation, violating Permit 20OPWE420, Section II, Condition 6.6.2.",,,N,pressure monitoring
123-9D4B Inspection Report 2025.pdf,State Pronghorn 41-32 Central Production Facility,123-9D4B,15-Jan-25,November 2023,December 2024,K,"The source failed to provide records of final pressure of equipment after blow downs, violating Permit 20OPWE420, Section II, Condition 6.10.4.",,,N,permit
123-9D4B Inspection Report 2025.pdf,State Pronghorn 41-32 Central Production Facility,123-9D4B,15-Jan-25,November 2023,December 2024,L,"The source failed to provide records of the 2024 annual training program during the compliance period, including the date and names of persons trained, violating Regulation 7, Part D § II.C.5.a(iv)(D).",,,N,other
123-9D4B Inspection Report 2025.pdf,State Pronghorn 41-32 Central Production Facility,123-9D4B,15-Jan-25,November 2023,December 2024,M,"The source failed to submit a permit modification within sixty (60) days to the Division, violating Permit 20OPWE420, Section II, Condi tion 1.10.6. This non-compliance issue was identified in the stack test report dated October 31, 2024, no further enforcement is recommended.",60,Days,N,test
123-9D4B Inspection Report 2025.pdf,State Pronghorn 41-32 Central Production Facility,123-9D4B,15-Jan-25,November 2023,December 2024,N,"The source failed to submit an NOS for point 022, violating Permit 15WE1257 Iss 4 Condition",,,N,NOS
123-9D4B Inspection Report 2025.pdf,State Pronghorn 41-32 Central Production Facility,123-9D4B,15-Jan-25,November 2023,December 2024,01,,,,N,other
1233815-INSP-2025.pdf,Ruegge 4H-N165,123-3815,21-Mar-25,February 2024,February 2025,A,"Source failed to follow the Operating and Maintenance plan’s requirement of daily control device monitoring on the dates listed below (14 days), violating Permit 19WE0052 Issuance 2, Condition 13.",14,Days,N,inspections
1233815-INSP-2025.pdf,Ruegge 4H-N165,123-3815,21-Mar-25,February 2024,February 2025,B,"Source failed to provide record of the maximum and minimum measured pressures for the pressure actuator system connected to the ECD’s for the months of February 2024 through July 2024, violating Regulation Number 7 Part B §§ II.B.2.f.",,,N,pressure monitoring
1233815-INSP-2025.pdf,Ruegge 4H-N165,123-3815,21-Mar-25,February 2024,February 2025,C,"Source failed to record the catalyst inlet temperature for the weeks of 4/28/24 and 5/5/24, violating Permit GP02, Condition VI.E.2.a. for AIRs Point 016.",2,Days,N,temperature monitoring
1233815-INSP-2025.pdf,Ruegge 4H-N165,123-3815,21-Mar-25,February 2024,February 2025,D,"Source failed to record the pressure drop for the months of May 2024 and June 2024, violating Permit GP02, Condition VI.E.3. The violations listed above were identified in the prior Division inspection on February 6, 2024 but were also ongoing during the current compliance period. The violations are being addressed in a pending enforcement action and no additional enforcement is recommended at this time.",,,N,pressure monitoring
1235660-INSP-2025.pdf,Wetco Farms A-4 Pad,123-5660,21-Nov-24,August 2023,August 2024,A,"Bonanza exceeded the rolling 12-month VOC emission limit for AIRS Points 008 for the rolling 12-month period of August 2023 to December 2023, violating Permit 13WE2521 Issuance 7, Condition 2.",,,N,permit
1235660-INSP-2025.pdf,Wetco Farms A-4 Pad,123-5660,21-Nov-24,August 2023,August 2024,B,"Bonanza exceeded the rolling 12-month throughput limit for AIRS Points 008 for the period of August 2023 through December 2023, violating Permit 13WE2521 Issuance 7, Condition 5.",,,N,throughput
1235660-INSP-2025.pdf,Wetco Farms A-4 Pad,123-5660,21-Nov-24,August 2023,August 2024,C,"Source failed to record weekly catalyst temps on point 016 from 8/1/2023 to 9/11/2023, violating Permit GP02, Condition VI.E.",,,N,permit
1235660-INSP-2025.pdf,Wetco Farms A-4 Pad,123-5660,21-Nov-24,August 2023,August 2024,D,"The source failed to maintain a catalyst temperature above 750◦F on point 016 from 9/27/2024 to 9/29/2024 violating GP02, Condition VI.E.2.a.",,,N,temperature monitoring
1235660-INSP-2025.pdf,Wetco Farms A-4 Pad,123-5660,21-Nov-24,August 2023,August 2024,E,"Source failed to conduct an inspection of the combustion device for the week of 8/4/2024, violating Permit 13WE2521 (7) Condition 10.",1,Days,N,inspections
1236310-INSP-2025.pdf,GP Production Facility,123-6310,09-Sep-25,September 2023,July 2025,A,"Extraction failed to monitor and record the pilot light and auto-igniter and a visible emissions observation of the enclosed flares on the dates listed in the table below, violating Permit Number 21WE0748, Condition 17, Permit Number 21WE0749, Condition 17, and Permit Number 21WE0750, Condition",,,N,temperature monitoring
1236310-INSP-2025.pdf,GP Production Facility,123-6310,09-Sep-25,September 2023,July 2025,18,,,,N,other
1237168-INSP-2025.pdf,Peterson 5-63-30 SWSE,123-7168,03-Sep-25,May 2024,June 2025,A,"The Source failed to monitor and record the catalyst inlet temperatures for fifteen (15) days during the compliance period (see table below), violating Regulation 26, Part B § I.D.5.e.(ii).",15,Days,N,temperature monitoring
1237168-INSP-2025.pdf,Peterson 5-63-30 SWSE,123-7168,03-Sep-25,May 2024,June 2025,B,"The Source failed to submit the NOS within the required timeline, violating Permit GP02, Condition IX.D.",2,Days,N,NOS
1237168-INSP-2025.pdf,Peterson 5-63-30 SWSE,123-7168,03-Sep-25,May 2024,June 2025,C,"The Source failed to record weekly maximum and minimum pressure actuator readings for fifteen (15) weeks from the beginning of the compliance period on 5/1/2024 to 8/11/2024, violating Regulation 7, Part B § II.B.2.f.(ii). This violation is on-going from the previous FCE completed on 6/25/2024 and has not yet been resolved in an Enforcement Case.",15,Weeks,N,pressure monitoring
1237168-INSP-2025.pdf,Peterson 5-63-30 SWSE,123-7168,03-Sep-25,May 2024,June 2025,D,"The Source failed to meet VOC emission limits, violating Permit GP02, Condition II.B.1.",1,Days,N,permit
1237401-INSP-2025.pdf,North Platte 44-13,123-7401,13-Nov-24,August 2021,August 2024,A,"The Source was unable to provide readings from 12/31/2022-2/28/2024, or fifty- nine (59) weeks during the compliance period, violating Regulation 7, Part B, § II.B.2.f.(ii)(G).",59,Weeks,N,other
1237401-INSP-2025.pdf,North Platte 44-13,123-7401,13-Nov-24,August 2021,August 2024,B,"The Source failed to conduct daily pilot light and visible emissions checks two hundred ninety-one (291) times between June 2022 and December 2022, and between July 2023 and September 2023, when the equipment was active.",291,Times,N,temperature monitoring
1237401-INSP-2025.pdf,North Platte 44-13,123-7401,13-Nov-24,August 2021,August 2024,C,"The Source exceeded 14 days between monitoring forty-six (46) times between 8/1/2021-11/8/2023 when Point 001 was covered by this permit (see table below), violating General Permit 01, Condition IV.C.3.",14,Days,N,inspections
1237401-INSP-2025.pdf,North Platte 44-13,123-7401,13-Nov-24,August 2021,August 2024,D,"The Source failed to conduct AVO inspections during loadout twenty-five (25) times throughout the compliance period (6/13/2022, 6/30/2022, 7/22/2022, 8/6/2022, 8/12/2022, 8/25/2022, 9/11/2022, 9/22/2022, 11/27/2022, 12/6/2022, 1/27/2023, 1/28/2023, 2/19/2023, 3/13/2023, 3/31/2023, 4/13/2023, 4/22/2023, 5/5/2023, 6/3/2023, 6/21/2023, 7/13/2023, 7/27/2023, 8/20/2023, 9/8/2023, 10/2/2023), violating Regulation 7, Part B, § II.C.1.d.",7,Days,N,inspections
1237401-INSP-2025.pdf,North Platte 44-13,123-7401,13-Nov-24,August 2021,August 2024,E,"The Source failed to inspect or monitor the air pollution control equipment at least weekly ninety-two (92) times during the compliance period (see table below), violating Regulation 7, Part B, § I.E.2.",92,Times,N,inspections
1239813-INSP-2025.pdf,Antelope Sec 19 Compressor Station,123- 9813,05-Mar-25,October 2023,November 2024,A,"The division did not finish processing the permit modification before the 270 day period ended and therefore Points 025, 026, and 027 operated without a permit from April 12, 2024 to 5/22/2025.",270,Days,N,permit
1239813-INSP-2025.pdf,Antelope Sec 19 Compressor Station,123- 9813,05-Mar-25,October 2023,November 2024,B,"The Source failed to record weekly catalyst temperatures for one (1) engine (Point 023) for the weeks of 1/14/2024 and 2/11/2024 during the compliance period, violating General Permit 02, Condition VI.E.2.",2,Days,N,temperature monitoring
1239813-INSP-2025.pdf,Antelope Sec 19 Compressor Station,123- 9813,05-Mar-25,October 2023,November 2024,C,"The Source failed to maintain the temperature between 750°F and 1250°F on 10/26/2023, 10/27/23, 2/10/24, 4/8/24, 5/8/24, 5/22/2024, and 9/15/24, violating Permit 23WE0147, Condition 18.",7,Days,N,temperature monitoring
1239813-INSP-2025.pdf,Antelope Sec 19 Compressor Station,123- 9813,05-Mar-25,October 2023,November 2024,D,"The Source failed to keep the catalyst inlet temperature within 750°F and 1250°F for two (2) engines during the compliance period (see below), violating General Permit 02, Condition VI.E.2.a.",11,Days,N,temperature monitoring
1239813-INSP-2025.pdf,Antelope Sec 19 Compressor Station,123- 9813,05-Mar-25,October 2023,November 2024,E,"The Source failed to prevent the pressure drop values from deviating by more than +/- 2 inches of water column for two (2) engines during the compliance period (see table below), violating General Permit 02, Condition VI.E.3.",,,N,pressure monitoring
1239813-INSP-2025.pdf,Antelope Sec 19 Compressor Station,123- 9813,05-Mar-25,October 2023,November 2024,F,"The Source failed to perform daily ECD monitoring on the following dates 10/4/23, 10/12/23 - 10/15/23, 10/23/23, 10/26/23 -10/31/23, 11/1/23, 11/9/23 - 11/14/23, 11/23/23 - 11/27/23, 12/7/23 - 12/12/23, 12/20/23 - 12/27/23, 1/16/24, 3/4/24, 4/18/24, 5/6/24, 5/16/24, 5/19/24, 5/20/24, 7/2/24, 8/26/24, and 8/27/24, violating Permit 12WE1563, Issuance 7, Condition 33 and Permit 21WE0239, Condition 19.",25,Days,N,inspections
1239813-INSP-2025.pdf,Antelope Sec 19 Compressor Station,123- 9813,05-Mar-25,October 2023,November 2024,G,"Source failed to adhere to maximum processing limits for Activities 1 and 5 under AIRS point 022, violating Permit 21WE0239 (1), Condition 7.",,,N,permit
1239960-INSP-2025.pdf,Pronghorn 14-11-7HZ,123-9960,21-Nov-24,April 2024,September 2024,,N/A,N/A,N/A,Y,other
12399DF-INSP-2025.pdf,Park T-4 Production Pad,123-99DF,13-Nov-24,August 2021,August 2024,A,"The Source failed to operate without visible emissions from the ECDs, violating Regulation 7, Part B, § I.C.1.d.",2,Times,N,other
12399DF-INSP-2025.pdf,Park T-4 Production Pad,123-99DF,13-Nov-24,August 2021,August 2024,B,"The Source failed to minimize emissions to the maximum extent practicable, violating Regulation 7, Part B, § I.C.1.b.",,,N,other
12399DF-INSP-2025.pdf,Park T-4 Production Pad,123-99DF,13-Nov-24,August 2021,August 2024,C,"The Source exceeded this limitation for nine (9) rolling 12-month periods during the compliance period (see table below), violating General Permit 01, Condition II.A.1.",,,N,permit
12399DF-INSP-2025.pdf,Park T-4 Production Pad,123-99DF,13-Nov-24,August 2021,August 2024,D,"The Source exceeded this limitation for ten (10) rolling 12-month periods during the compliance period (see table below), violating Permit 12WE2451, Issuance 7, Condition 6.",12,Month,N,permit
12399DF-INSP-2025.pdf,Park T-4 Production Pad,123-99DF,13-Nov-24,August 2021,August 2024,E,"The Source exceeded that processing rate for 10 rolling 12-month periods of the compliance period (see table below), violating Permit 12WE2451, Issuance 7, Condition 9.",12,Month,N,permit
12399DF-INSP-2025.pdf,Park T-4 Production Pad,123-99DF,13-Nov-24,August 2021,August 2024,F,"The Source failed to conduct at least weekly monitoring of the surveillance system thirty- nine (39) times during the compliance period (see table below), violating Regulation 7, Part B, § I.E.2.d.",39,Times,N,inspections
12399DF-INSP-2025.pdf,Park T-4 Production Pad,123-99DF,13-Nov-24,August 2021,August 2024,G,"The Source failed to record weekly catalyst inlet temperatures from 8/1/2021-11/5/2022, 11/13/2022-2/18/2023, and 2/26/2023-4/1/2023, violating General Permit 01, Condition VI.E.2.",,,N,temperature monitoring
12399DF-INSP-2025.pdf,Park T-4 Production Pad,123-99DF,13-Nov-24,August 2021,August 2024,H,"The Source failed to record monthly pressure drops for Point 025 from 8/2021-3/2023 (a total of twenty (20) months), and failed to keep the value within +/- 2 inches of the water column on 10/2023, violating General Permit 02, Condition VI.E.3.",20,Months,N,pressure monitoring
12399DF-INSP-2025.pdf,Park T-4 Production Pad,123-99DF,13-Nov-24,August 2021,August 2024,I,"The Source performed a portable analyzer test for Point 025 on 11/7/2022 but failed to record a new baseline pressure drop, violating General Permit 02, Condition VI.E.3.b.",1,Days,N,pressure monitoring
12399DF-INSP-2025.pdf,Park T-4 Production Pad,123-99DF,13-Nov-24,August 2021,August 2024,J,"The Source exceeded 14 days between monitoring nineteen (19) times between 8/1/2021-11/1/2023 when Point 001 was covered by this permit (see table below), violating General Permit 01, Condition IV.C.3.",14,Days,N,inspections
12399DF-INSP-2025.pdf,Park T-4 Production Pad,123-99DF,13-Nov-24,August 2021,August 2024,K,"The Source failed to monitor the control equipment multiple times during the compliance period (see table below), violating Permit 12WE2451, Issuance 6, Condition 13.",,,N,inspections
12399DF-INSP-2025.pdf,Park T-4 Production Pad,123-99DF,13-Nov-24,August 2021,August 2024,L,"The Source failed to conduct AVO inspections during loadout eighty-eight (88) times during the compliance period, violating Regulation 7, Part B, § II.C.1.d.",7,Days,N,inspections
12399E3-INSP-2026 PDF.pdf,Pronghorn 41-11-9HZ Tank Battery,123-99E3,23-Oct-25,August 2022,August 2025,,N/A,N/A,N/A,Y,other
12399E7-INSP-2026.pdf,State Antelope 31-11HZ,123-99E7,12-Nov-25,September 2022,September 2025,,N/A,N/A,N/A,Y,other
12399E8-INSP-2026.pdf,State Antelope 14-24 Pad,123-99E8,12-Nov-25,September 2022,September 2025,A,"Source failed to conduct weekly visual inspections of air pollution control equipment Points 010 and 020, violating Regulation 7, Part B §§ II.B.2.f. a.",22,Days,N,inspections
12399E8-INSP-2026.pdf,State Antelope 14-24 Pad,123-99E8,12-Nov-25,September 2022,September 2025,B,"Source failed to conduct weekly visual inspections of air pollution control equipment Points 010 and 020, violating Permit 12WE0416 (4), Condition 13. a. 10/30/2022, 11/6/2022, 11/27/2022, 12/4/2022, 12/18/2022, 12/25/2022, 1/1/2023,1/8/23, 1/15/23, 2/26/23, 3/12/23, 4/23/23, 5/7/23, 5/14/23, 6/4/23, 6/11/23, 6/18/23, 7/23/23, 8/6/23, 8/20/23, 8/27/23, 9/10/23 The violations are not ongoing, and the equipment has been removed from the site.",22,Days,N,inspections
1239A19-INSP-2025 Approved.pdf,French Lake 3-63-14-3H,123-9A19,13-Mar-25,February 2024,December 2024,,"Civitas doing business as Bonanza Creek failed to adhere to the VOC limit of 2.90 VOC (ton/yr) for AIRS Point 007, ROPE, for the months of February, March, and April 2024, during the inspection compliance period of February 2024 through December 2024, violating General Permit 11.",3,Months,N,inspections
1239B3B-INSP-2024.pdf,Bonanza Creek Energy Operating Company - Antelope F-15,123/9,12-Sep-24,May 2023,June 2024,,N/A,N/A,N/A,Y,other
1239BEE-INSP-2025.pdf,State North Platte CPF 42-26,123-9BEE,11-Jun-25,June 2024,April 2025,A,"Bonanza failed to maintain the NOx and CO emission factors as required, violating Permit 20OPWE419, Section II, Condition 1.10.3.",1,Days,N,permit
1239BEE-INSP-2025.pdf,State North Platte CPF 42-26,123-9BEE,11-Jun-25,June 2024,April 2025,B,"Bonanza failed to maintain a NOx emission factor as required, violating Permit 20OPWE419, Section II, Condition 3.8.3.",1,Days,N,permit
1239BEE-INSP-2025.pdf,State North Platte CPF 42-26,123-9BEE,11-Jun-25,June 2024,April 2025,C,"Source failed to maintain the total quantity of emission events below the applicable limits for Point 050 activities 10 between November 2024 - April 2025 and for activity 11 between January - April 2025, violating Permit 20OPWE419, Section II, Condition 8.4. See table below for more details.",12,Month,N,permit
1239BEE-INSP-2025.pdf,State North Platte CPF 42-26,123-9BEE,11-Jun-25,June 2024,April 2025,D,"Source failed to operate Point 014 without venting, violating 20OPWE419, Section II, Condition 10.8.2.1 and AQCC Regulation 7 Part B § II.C.2.a. See additional details in additional inspection notes below.",1,Days,N,inspections
1239BEE-INSP-2025.pdf,State North Platte CPF 42-26,123-9BEE,11-Jun-25,June 2024,April 2025,E,"Source failed to design, operate and maintain Point 014 so as to minimize leakage of volatile organic compounds to the atmosphere to the maximum extent practicable, violating AQCC Regulation 7 Part B § I.C.1.b. See additional details in additional inspection notes below.",1,Days,N,inspections
1239BEE-INSP-2025.pdf,State North Platte CPF 42-26,123-9BEE,11-Jun-25,June 2024,April 2025,F,"Source failed to operate a combustion device used to control VOC emissions without visible emissions, violating AQCC Regulation 7 Part B § I.C.1.d. and II.B.2.b., and Permit 20OPWE419 Conditions 10.1.1.4 and 10.7.2.2. See additional details in additional inspection notes below.",1,Days,N,inspections
