1239BEE-INSP-2025.pdf,State North Platte CPF 42-26,123-9BEE,11-Jun-25,June 2024,April 2025,G,"Source failed to conduct an EPA Reference Method 22 observation when smoke was observed from the ECD, violating Permit 20OPWE419, Conditions 1.9.2.2.b; 2.7.2.2.a; 3.7.2.2.b; 4.9.3.2.b; 5.7.2.2; and 8.9.1.1.b.",1,Days,N,permit
1239BEE-INSP-2025.pdf,State North Platte CPF 42-26,123-9BEE,11-Jun-25,June 2024,April 2025,H,"Source failed to conduct a quarterly portable analyzer test for Point 048, violating Permit 20OPWE419, Section II, Condition 6.1.2. and 13.",,,N,test
1239BEE-INSP-2025.pdf,State North Platte CPF 42-26,123-9BEE,11-Jun-25,June 2024,April 2025,I,"Source failed to include the visible emissions deviations in the Title V SAR within 6 months of the observed visible emissions, violating Permit 20OPWE419, Section IV, Condition 21.b.(iii).",6,Months,N,permit
1239BEE-INSP-2025.pdf,State North Platte CPF 42-26,123-9BEE,11-Jun-25,June 2024,April 2025,J,"Source failed to conduct the 2024 annual emission factor verification analysis for Point 046, violating Permit 20OPWE419, Section II, Condition 5.4.",,,N,permit
1239BEE-INSP-2025.pdf,State North Platte CPF 42-26,123-9BEE,11-Jun-25,June 2024,April 2025,K,"Source failed to continuously Air Pollution Control Division monitor and record the pilot light presence, violating Permit 20OPWE419, Section II Conditions 1.9.2.1; 2.7.1; 3.7.2.1; 3.9; 4.9.3.1; 5.7.1; and 8.9.1.",,,N,temperature monitoring
1239BEE-INSP-2025.pdf,State North Platte CPF 42-26,123-9BEE,11-Jun-25,June 2024,April 2025,L,"Source failed to report excursions as required, violating Permit 20OPWE419, Section IV, Condition 22.d.",6,Months,N,permit
1239BEE-INSP-2025.pdf,State North Platte CPF 42-26,123-9BEE,11-Jun-25,June 2024,April 2025,M,"Source failed to apply for a permit modification within 60 days of the verification analysis, violating Permit 20OPWE419, Section II Conditions 2.4 and 4.6.",60,Days,N,permit
1239BEE-INSP-2025.pdf,State North Platte CPF 42-26,123-9BEE,11-Jun-25,June 2024,April 2025,N,"Source exceeded the gauge pressure limit at actual conditions prior to one-hundred ninety-five (195) ROPE events for Point 050, violating Permit 20OPWE419, Section II, Condition 8.6.2.",,,N,pressure monitoring
1239C0F-INSP-2025.pdf,18492 Hawkins 5-61-21,123-9C0F,03-Sep-25,July 2024,June 2025,,N/A,N/A,N/A,Y,other
1239C71_INSP_2025.pdf,Qualls 28H-M358,123-9C71,30-Jul-25,May 2022,May 2025,A,"Source failed to inspect control equipment on a weekly basis, violating Regulation Citation Part D §§ I.E.2.c and II.B.2.f) (Part B §§ I.E.2.c and II.B.2.f as of June 14, 2023). This noncompliance is being addressed under the self-audit submission and no additional enforcement recommended.",12,Days,N,inspections
1239C71_INSP_2025.pdf,Qualls 28H-M358,123-9C71,30-Jul-25,May 2022,May 2025,B,"Source failed to conduct weekly monitoring of pilot light, auto-ignitor, and visible emission checks via auto-ignitor signal or visual inspection, violating Permit 20WE0787, Condition 15. This noncompliance is being addressed under the self-audit submission and no additional enforcement recommended.",12,Days,N,temperature monitoring
1239C71_INSP_2025.pdf,Qualls 28H-M358,123-9C71,30-Jul-25,May 2022,May 2025,C,"Source failed to record weekly catalyst inlet temperature for AIRS point 008 and 009 (see table below for missing catalyst temperature readings), violating Permit GP02, Condition VI.E.2.",,,N,temperature monitoring
1239C71_INSP_2025.pdf,Qualls 28H-M358,123-9C71,30-Jul-25,May 2022,May 2025,D,"Source failed to record monthly readings of pressure drop across the catalyst bed, violating Permit GP02, Condition VI.E.3. AIRS Point 008 Missing Weekly Temperature monitoring Missing Monthly Dp readings 7/9/2023 - 7/15/2023 7/23 7/16/2023 - 7/22/2023 8/23 7/23/2023 - 7/29/2023 9/23 7/30/2023 - 8/5/2023 10/23 8/6/2023 - 8/12/2023 11/23 8/13/2023 - 8/19/2023 - 8/20/2023 - 8/26/2023 - 8/27/2023 - 9/2/2023 - 9/3/2023 - 9/9/2023 - 9/10/2023 - 9/16/2023 - 9/17/2023 - 9/23/2023 - 9/24/2023 - 9/30/2023 - 10/1/2023 - 10/7/2023 - 10/8/2023 - 10/14/2023 - 10/15/2023 -10/21/2023 - 10/22/2023 - 10/28/2023 - 10/29/2023 - 11/4/2023 - 11/5/2023 - 11/11/2023 - AIRS Point 009 Missing Weekly Temperature monitoring Missing Monthly Dp readings 7/9/2023 - 7/15/2023 7/23 7/16/2023 - 7/22/2023 8/23 7/23/2023 - 7/29/2023 9/23 7/30/2023 - 8/5/2023 10/23 8/6/2023 - 8/12/2023 11/23 8/13/2023 - 8/19/2023 - 8/20/2023 - 8/26/2023 - 8/27/2023 - 9/2/2023 - 9/3/2023 - 9/9/2023 - 9/10/2023 - 9/16/2023 - 9/17/2023 - 9/23/2023 - 9/24/2023 - 9/30/2023 - 10/1/2023 - 10/7/2023 - 10/8/2023 - 10/14/2023 - 10/15/2023 -10/21/2023 - 10/22/2023 - 10/28/2023 - 10/29/2023 - 11/4/2023 - 11/5/2023 - 11/11/2023 - Violations A and B were reported in a Self-Audit. These violations will be addressed under the Self Audit and no additional enforcement is recommended at this time. For violations C and D the inspector recommends a Warning Letter to resolve the non-compliance issue(s) identified as a result of the inspection and a review of the records.",,,N,pressure monitoring
1239C76_FCE_2025.pdf,Anschutz State 5-62-25-0108X,123-9C76,11-Mar-25,January 2022,January 2025,A,"Source failed to conduct weekly inspections of the control equipment for AIRS point 006, violating Regulation 7 Citation (Part D §§ I.E.2.c and II.B.2.f) (Part B §§ I.E.2.c and II.B.2.f as of June 14, 2023).",,,N,inspections
1239C76_FCE_2025.pdf,Anschutz State 5-62-25-0108X,123-9C76,11-Mar-25,January 2022,January 2025,B,"Source failed to perform weekly inspections as required by Regulation 7 Section XII.E(Regulation 7 Section I.E as of 6/14/2023)), Violating Permit GP01, condition IV.C.3.",14,Days,N,inspections
1239C76_FCE_2025.pdf,Anschutz State 5-62-25-0108X,123-9C76,11-Mar-25,January 2022,January 2025,C,"Source failed to operate the engine to have catalyst in applicable limits for AIRS point 013, violating Regulation 26 Citation (Part B §§ I.D.6.d.(ii)(A)).",,,N,other
1239C76_FCE_2025.pdf,Anschutz State 5-62-25-0108X,123-9C76,11-Mar-25,January 2022,January 2025,D,"Source failed to record a pressure drop reading during 5/2024 for AIRS point 013, violating Regulation 26 Citation (Part B §§ I.D.6.d.(ii)(B)).",,,N,pressure monitoring
1239C76_FCE_2025.pdf,Anschutz State 5-62-25-0108X,123-9C76,11-Mar-25,January 2022,January 2025,E,"Source failed to perform a PAT for the second half of 2023 for AIRS point 012, violating Permit GP02, Condition VI.E.",,,N,permit
1239C82-INSP-2025.pdf,Helton 5-63-27 Production Pad,123-9C82,12-Dec-24,October 2021,October 2024,,N/A,N/A,N/A,Y,other
1239C98_FCE_2025.pdf,70 Ranch 4-63-3 PAD 2,123-9C98,11-Mar-25,January 2022,January 2025,A,"Source failed to conduct weekly inspection of the air pollution control equipment, violating Regulation 7 Citation (Part D §§ I.E.2.c and II.B.2.f) (Part B §§ I.E.2.c and II.B.2.f as of June 14, 2023).",,,N,inspections
1239C98_FCE_2025.pdf,70 Ranch 4-63-3 PAD 2,123-9C98,11-Mar-25,January 2022,January 2025,B,"Source failed to conduct weekly pilot light, auto-igniter, and visible emissions monitoring, violating Permit 14WE1158, Condition 13.",,,N,temperature monitoring
1239C98_FCE_2025.pdf,70 Ranch 4-63-3 PAD 2,123-9C98,11-Mar-25,January 2022,January 2025,C,"Source failed to monitor storage tanks controlled by a ECD on a weekly basis, violating Permit GP08, Condition IV.C.",,,N,inspections
1239C98_FCE_2025.pdf,70 Ranch 4-63-3 PAD 2,123-9C98,11-Mar-25,January 2022,January 2025,D,"Source failed to perform weekly inspections (Regulation 7 Section XII.E (Regulation 7 Section I.E as of 6/14/2023)) of control equipment for AIRS point 002, violating Permit GP05, Condition IV.B.4.",14,Days,N,inspections
1239C98_FCE_2025.pdf,70 Ranch 4-63-3 PAD 2,123-9C98,11-Mar-25,January 2022,January 2025,E,"Source failed to accurately measure catalyst inlet temperatures. Readings below 750 were reported, vendor came out to inspect the unit and it was suspected that readings were taken during low load/start up conditions (no maintenance was required), violating Permit GP02, Condition VI.E.2.a. AIRS Point Date Temperature out of range 010 4/23/2023 688 010 4/24/2023 688 Violations A, B, C were disclosed in the 5/19/2023 and 2/9/2024 self audit. The noncompliance will be evaluated under the Audit Law.",4,Days,N,temperature monitoring
1239CAA-INSP-2025.pdf,Winder Production Facility,123-9CAA,09-Sep-25,September 2023,May 2025,,N/A,N/A,N/A,Y,other
1239D1F-INSP-2024 ENF.pdf,Crow Valley 7-62-22-H,123-9D1F,13-Feb-25,December 2021,December 2024,A,"Source failed to submit an APEN from December 2021- February 2022 when VOC emissions exceeded 1 TPY in the non- attainment area, violating Part A, § II.A.1 and II.B.3.a. Month and Year VOC (TPY) December 2021* 1.50 January 2022 1.26 February 2022 1.",,,N,APEN
1239D1F-INSP-2024 ENF.pdf,Crow Valley 7-62-22-H,123-9D1F,13-Feb-25,December 2021,December 2024,B,"The source failed to conduct over 60% of their weekly ECD inspections as seen in the table directly below, violating (Part D §§ I.E.2.c and II.B.2.f) (Part B §§ I.E.2.c and II.B.2.f as of June 14, 2023.",,,N,inspections
1239D27-INSP-2025.pdf,Lochbuie 31H-D165 Battery,123-9D27,23-Apr-25,February 2022,February 2025,A,"Source failed to record the catalyst inlet temperature weekly for AIRS Points 022 & 023 during the given timeframes below, violating General Permit 02, Condition VI.E.2.",,,N,temperature monitoring
1239D27-INSP-2025.pdf,Lochbuie 31H-D165 Battery,123-9D27,23-Apr-25,February 2022,February 2025,B,"Source failed to record the pressure drop across the catalyst bed for AIRS Points 022 & 023 during the given timeframes below, violating General Permit 02, Condition VI.E.3.",,,N,pressure monitoring
1239D27-INSP-2025.pdf,Lochbuie 31H-D165 Battery,123-9D27,23-Apr-25,February 2022,February 2025,C,"Source failed to perform a semi- annual performance test for Point 022 in the first half of 2024 and the source also failed to perform semi-annual testing for Point 023 for all of 2024, violating GP02, Condition VI.E.4.",,,N,test
1239D8D-INSP-2025.pdf,Anshutz Equus Farms 4-62-33,123-9D8D,03-Sep-25,May 2024,June 2025,A,"The Source failed to meet VOC emission limits, violating Permit GP02, Condition II.B.1.",1,Days,N,permit
1239D8D-INSP-2025.pdf,Anshutz Equus Farms 4-62-33,123-9D8D,03-Sep-25,May 2024,June 2025,B,"the Source failed to record weekly minimum and maximum pressures from May 1, 2024 through August 27, 2024, violating Regulation 7, Part B, Section II.B.2.f(ii)(G). This violation is on-going from the previous FCE completed on 7/10/2024 and has not yet been resolved in an Enforcement Case.",1,Days,N,other
1239D9A_FCE_2025.pdf,Anschutz Coffelt 5-61-35_36,123-9D9A,11-Mar-25,January 2022,December 2024,A,"Source failed to minimize leakage of VOC to the atmosphere to the maximum extent practicable, violating Regulation 7 Citation (Part D § I.C.1.b) (Part B § I.C.1.b as of June 14, 2023).",2,Days,N,design analysis
1239D9A_FCE_2025.pdf,Anschutz Coffelt 5-61-35_36,123-9D9A,11-Mar-25,January 2022,December 2024,B,"Source failed to operate without venting hydrocarbon emissions from PRV, violating Regulation 7 Citation (Part D § II.C.2.a) (Part B § II.C.2.a as of June 14, 2023).",2,Days,N,design analysis
1239D9A_FCE_2025.pdf,Anschutz Coffelt 5-61-35_36,123-9D9A,11-Mar-25,January 2022,December 2024,C,"Source failed to inspect the control equipment on a weekly basis, violating Regulation 7 Citation (Part D §§ I.E.2.c and II.B.2.f) (Part B §§ I.E.2.c and II.B.2.f as of June 14, 2023).",16,Weeks,N,inspections
1239D9A_FCE_2025.pdf,Anschutz Coffelt 5-61-35_36,123-9D9A,11-Mar-25,January 2022,December 2024,D,"Source failed to conduct weekly pilot light and auto igniter monitoring and visible emissions observation via visual inspection or auto-igniter signal violating Permit 20WE0132, Condition",,,N,temperature monitoring
1239D9A_FCE_2025.pdf,Anschutz Coffelt 5-61-35_36,123-9D9A,11-Mar-25,January 2022,December 2024,18,,16,Weeks,N,other
1239D9A_FCE_2025.pdf,Anschutz Coffelt 5-61-35_36,123-9D9A,11-Mar-25,January 2022,December 2024,E,"Source failed to conduct weekly pilot light and auto igniter monitoring and visible emissions observation via visual inspection or auto-igniter signal violating Permit GP08, Condition IV.C.",16,Weeks,N,temperature monitoring
1239DB8-INSP-2025.pdf,JILSON-EAST RINN M268,123-9DB8,15-Jul-25,May 2022,May 2025,A,"The Source failed to minimize emissions of VOCs to the maximum extent practicable, violating Regulation 7, Part B § I.C.1.b. and Permit GP01, Condition IV.A.",1,Times,N,permit
1239DB8-INSP-2025.pdf,JILSON-EAST RINN M268,123-9DB8,15-Jul-25,May 2022,May 2025,B,"The Source failed to operate without venting and failed to route all hydrocarbon emissions to the control equipment, violating Regulation 7, Part B § II.C.2.a.",1,Times,N,design analysis
1239DB8-INSP-2025.pdf,JILSON-EAST RINN M268,123-9DB8,15-Jul-25,May 2022,May 2025,C,"The Source failed to provide records of the weekly minimum and maximum flow rate for a period of one- hundred and fifteen (115) weeks from the beginning of the compliance period (May 2022) until 7/15/2024, violating Regulation 7, Part B § II.B.2.f.",115,Weeks,N,flow monitoring
1239DB8-INSP-2025.pdf,JILSON-EAST RINN M268,123-9DB8,15-Jul-25,May 2022,May 2025,D,"The Source failed to provide records of one (1) portable analyzer test that should have been completed for the engine associated with Point 011 in the second half of 2023, violating Permit GP02, Condition VI.E.4.",,,N,test
1239DB8-INSP-2025.pdf,JILSON-EAST RINN M268,123-9DB8,15-Jul-25,May 2022,May 2025,E,"The Source failed to record a weekly catalyst inlet temperature for the engine associated with Point 011 for forty-eight (48) weeks during the compliance period (see table below), violating Permit GP02, Condition VI.E.2.",48,Weeks,N,temperature monitoring
1239DB8-INSP-2025.pdf,JILSON-EAST RINN M268,123-9DB8,15-Jul-25,May 2022,May 2025,F,"The Source failed to record the pressure drop across the catalyst bed of the engine associated with Point 011 for ten (10) months (see table below) during the compliance period, violating Permit GP02, Condition VI.E.3.",10,Months,N,pressure monitoring
1239DB8-INSP-2025.pdf,JILSON-EAST RINN M268,123-9DB8,15-Jul-25,May 2022,May 2025,G,"The Source failed to conduct weekly inspections of the control equipment used to control emissions from Points 001, 002, 003, 010 for five (5) weeks during the compliance period (see table below), violating Regulation 7, Part B § II.B.2.f.",5,Weeks,N,inspections
1239DB8-INSP-2025.pdf,JILSON-EAST RINN M268,123-9DB8,15-Jul-25,May 2022,May 2025,H,"The Source failed to conduct weekly visual checks for the pilot light and visible emissions for five (5) weeks during the compliance period (see table above), violating Permit 15WE0592 (1), Condition 14, and Permit 20WE0413 (1), Condition 17.",5,Weeks,N,temperature monitoring
1239DE2-INSP-2025.pdf,EDITH ANN-DUCKWORTH 21H,123-9DE2,15-Jul-25,May 2022,May 2025,A,"The Source failed to conduct weekly inspections of the control equipment for eleven (11) weeks during the compliance period (see table below), violating Regulation 7, Part B § II.B.2.f.",11,Weeks,N,inspections
1239DE2-INSP-2025.pdf,EDITH ANN-DUCKWORTH 21H,123-9DE2,15-Jul-25,May 2022,May 2025,B,"The Source failed to conduct weekly visual checks for the pilot light and visible emissions for eleven (11) weeks during the compliance period (see table above), violating Permit 15WE0905 (2), Condition 15 and Permit 20WE0763 (1), Condition 15.",11,Weeks,N,temperature monitoring
1239DE2-INSP-2025.pdf,EDITH ANN-DUCKWORTH 21H,123-9DE2,15-Jul-25,May 2022,May 2025,C,"Source failed to conduct daily ECD checks for forty-six (46) days (see table below), violating Permit 20WE0763 (2), Condition 14. AIRS Point Dates of Missing Daily Monitoring for Control Equipment 007 2023 Aug: 29, 30 Sep: 07, 08, 11, 15, 21, 22, 23 Oct: 05 Nov: 01 Dec: 15, 23, 31 AIRS Point Dates of Missing Daily Monitoring for Control Equipment 2024 Jan: 03, 10, 12, 14, 15, 16, 24 Feb: 01, 02, 03, 07, 16, 19, 23 Mar: 17, 19, 20, 28 Apr: 20 May: 18, 24 Jun: 07 Aug: 24 Sep: 05, 07, 08, 20, 23 Oct: 04, 05, 06, 21 Violations A, B, and C will be addressed in a pending Self-Audit.",46,Days,N,inspections
1239DEB Inspection Report 2025.pdf,RUH 6-62-11 Production F acility,123-9DEB,14-Nov-24,September 2021,September 2024,A,,,,N,other
1239DEB Inspection Report 2025.pdf,RUH 6-62-11 Production F acility,123-9DEB,14-Nov-24,September 2021,September 2024,2023,"Source failed to perform weekly ECD checks during the following weeks: 1/9/22, 1/23/22, 3/6/22, 3/13/22, 3/20/22, 4/3/22, 5/8/22, 5/15/22, 5/22/22, 6/19/22, 6/26/22, 7/10/22, 7/17/22, 8/28/22, 9/18/22, 9/25/22, 10/16/22, 10/23/22, 11/13/22, 11/20/22, 12/4/22, 12/18/22, 12/25/22, 1/1/23, 1/8/23, 1/15/23, 3/12/23, 5/7/23. And, Source failed to conduct daily control device monitoring inspections on the following days: 6/12/23-6/30/23, 7/2/23, 7/3/23, 7/4/23, 7/6/23, 7/7/23, 7/8/23, 7/10/23-7/22/23, 7/24/23-8/5/23, 8/7/23-8/19/23, 8/21/23-9/13/23, 9/18/23-9/26/23, 10/4/23-10/7/23, 10/9/23, 10/10/23, 10/15/23, 10/18/23, 10/19/23, 10/21/23, 10/22/23, 10/24/23, 10/27/23, 11/3/23, 11/5/23, 11/6/23, 11/7/23, 11/11/23, 12/12/23, 1/3/24, 1/8/24, 1/10/24, 1/13/24, 1/14/24, 1/16/24, 1/17/24, 1/18/24, 1/23/24, 1/25/24, 1/29/24-2/7/24, 2/10/24- 2/27/24, 3/2/24, 3/6/24-3/12/24, 3/14/24, 3/16/24, 3/19/24-3/30/24, 4/1/24, 4/3/24-4/9/24, 4/13/24, 4/16/24, 4/17/24, 4/24/24, 4/29/24, 4/30/24, 5/9/24, 5/10/24, 5/11/24, 5/23/24, 5/24/24, 5/25/24, 5/27/24, 7/4/24, 7/5/24, 7/25/24, 7/27/24, 7/29/24, 7/30/24.",106,Days,N,inspections
1239DEB Inspection Report 2025.pdf,RUH 6-62-11 Production F acility,123-9DEB,14-Nov-24,September 2021,September 2024,19,,,,N,other
1239DEB Inspection Report 2025.pdf,RUH 6-62-11 Production F acility,123-9DEB,14-Nov-24,September 2021,September 2024,B,"Source failed to perform weekly ECD checks during the weeks of: 1/9/22, 1/23/22, 3/6/22, 3/13/22, 3/20/22, 4/3/22, 5/8/22, 5/15/22, 5/22/22, 6/19/22, 6/26/22, 7/10/22, 7/17/22, 8/28/22, 9/18/22, 9/25/22, 10/16/22, 10/23/22, 11/13/22, 11/20/22, 12/4/22, 12/18/22, 12/25/22, 1/1/23, 1/8/23, 1/15/23, 3/12/23, 5/7/23, 6/18/23, 7/16/23, 7/30/23, 8/13/23, 8/27/23, 9/3/23, 2/11/24, 2/18/24, 3/24/24. Source failed to conduct weekly inspections of control equipment for thirty-seven (37) weeks during the compliance period, violating Regulation 7, Part B, §§ I.E.2.c. and II.B.2.f.",37,Weeks,N,inspections
1239DEB Inspection Report 2025.pdf,RUH 6-62-11 Production F acility,123-9DEB,14-Nov-24,September 2021,September 2024,C,"Source failed to record temperature readings for Point 009 from May 1, 2023 through January 20, 2024. Additionally, Source did not take corrective action when Point 011 temperatures were out of range during weeks of: 4/28/24, 6/9/24-7/6/24, and 7/28/24-8/24/24. Source failed to record catalyst inlet temperatures for thirty-eight (38) weeks and failed to take corrective actions when temperatures were out of range for nine (9) weeks during the compliance period, violating GP02, Condition VI.E.2.",38,Weeks,N,temperature monitoring
1239DEB Inspection Report 2025.pdf,RUH 6-62-11 Production F acility,123-9DEB,14-Nov-24,September 2021,September 2024,D,"Source did not record pressure drop readings for Point 009 from May 2023 through January 2024. And, Source did not record pressure drop readings for Point 011 from May 2024 through August 2024. Source failed to record monthly pressure drop readings for Point 009 for thirteen (13) months during the compliance period, violating GP02, Condition VI.E.3.",13,Months,N,pressure monitoring
1239DEB Inspection Report 2025.pdf,RUH 6-62-11 Production F acility,123-9DEB,14-Nov-24,September 2021,September 2024,E,"Source failed to provide maintenance records during the compliance period, violating GP02, Conditions VI.B.1, VI.B.2, VI.B.3, VI.B.4, and VI.C.2.",,,N,other
1239DEB Inspection Report 2025.pdf,RUH 6-62-11 Production F acility,123-9DEB,14-Nov-24,September 2021,September 2024,F,"Source failed to install and record readings from the pressure actuator system from May 1, 2023 until September 7, 2024, violating Regulation 7, Part B §§ II.B.2.g and II.B.2.f.(ii)(G).",,,N,pressure monitoring
1239DF2-INSP-2025.pdf,Antelope CPF 13-21,123-9DF2,16-Jul-25,May 2024,May 2025,A,"the Source failed to limit the NOx emission factors for Point 011 to 0.068 lb/MMBtu, violating Operating Permit 20OPWE417, Section II, Condition 4.9. The Source obtained an updated Construction Permit (15WE1001, Issuance 6; permit modification submitted January 25, 2023) on January 24, 2025 that partially addressed the NOx emission factor exceedance, but the results of the November 2024 testing showed ECD 2 was still above the permitted emission factor. The Source submitted a second permit modification application on February 27, 2025.",,,N,test
1239DF2-INSP-2025.pdf,Antelope CPF 13-21,123-9DF2,16-Jul-25,May 2024,May 2025,024,,,,N,other
1239DF2-INSP-2025.pdf,Antelope CPF 13-21,123-9DF2,16-Jul-25,May 2024,May 2025,B,"As required by Operating Permit 20OPWE417, Section II, Condition 4.9.6.2, the “failed” emission factors must be retroactively applied to the emissions for Point",,,N,permit
1239DF2-INSP-2025.pdf,Antelope CPF 13-21,123-9DF2,16-Jul-25,May 2024,May 2025,011,"The Source failed to limit NOx emissions to 1.6 tpy between May 1, 2024 and January 23, 2025, violating Operating Permit 20OPWE417, Section II, Condition 4.1. This issue was identified in the Stack Test and is being addressed under Case Number 2025-024. Month, Year Emissions of NOx (tpy) May 2024 3.84 June 2024 3.46 July 2024 3.30 August 2024 3.26 September 2024 3.14 October 2024 3.06 November 2024 2.64 December 2024 2.21 January 2025 2.",,,N,test
1239DF2-INSP-2025.pdf,Antelope CPF 13-21,123-9DF2,16-Jul-25,May 2024,May 2025,C,"The Source did not submit a permit modification request until February 27, 2025, violating Operating Permit 20OPWE417, Section II, Condition 4.9.6. This violation is being addressed under Case Number 2025-024.",60,Days,N,permit
1239DF2-INSP-2025.pdf,Antelope CPF 13-21,123-9DF2,16-Jul-25,May 2024,May 2025,D,"The Source failed to limit the NOx emissions to 8.1 tpy, violating Permit 20WE0191, Issuance 3, Condition 4.",,,N,permit
1239DF2-INSP-2025.pdf,Antelope CPF 13-21,123-9DF2,16-Jul-25,May 2024,May 2025,E,"The Source was required to submit a Semi-Annual Report by October 1, 2024 but did not submit the report until October 4, 2024, violating Operating Permit 20OPWE417, Section IV, Condition 22d.",6,Months,N,permit
1239DF2-INSP-2025.pdf,Antelope CPF 13-21,123-9DF2,16-Jul-25,May 2024,May 2025,F,"The Source failed to record pre-catalyst temperatures for Point 020 for eight (8) days during the compliance period, from March 12, 2025 through March 19, 2025, violating Permit 20WE0414, Issuance 2, Condition",8,Days,N,temperature monitoring
1239DF2-INSP-2025.pdf,Antelope CPF 13-21,123-9DF2,16-Jul-25,May 2024,May 2025,16,"The engine’s temperature sensor failed and Civitas contacted Archrock to fix the sensor, which was completed and temperatures were being recorded again as of March 20, 2025.",,,N,temperature monitoring
1239DF2-INSP-2025.pdf,Antelope CPF 13-21,123-9DF2,16-Jul-25,May 2024,May 2025,G,"The Source conducted a portable analyzer test on April 9, 2025 which surpassed 14 days from the exceedance, violating Permit 20WE0414, Issuance 2, Condition 16.",14,Days,N,test
1239DF2-INSP-2025.pdf,Antelope CPF 13-21,123-9DF2,16-Jul-25,May 2024,May 2025,H,"The Source failed to record the catalyst inlet temperature for Point 021 for eight (8) days during the compliance period, from July 30, 2024 through August 6, 2024, violating Operating Permit 20OPWE417, Section II, Condition 6.8.1. The missing temperature information was caused by the transition between automation system units and was resolved on August 7, 2024.",8,Days,N,temperature monitoring
1239DF2-INSP-2025.pdf,Antelope CPF 13-21,123-9DF2,16-Jul-25,May 2024,May 2025,I,"The Source identified a leak on June 24, 2024 but did not conduct a first repair attempt until July 2, 2024, six (6) working days after the leak was identified, violating Regulation 7, Part B, § I.L.5.a.",,,N,other
1239DF2-INSP-2025.pdf,Antelope CPF 13-21,123-9DF2,16-Jul-25,May 2024,May 2025,J,"The Source did not provide semi-annual results of the heat content of the natural gas fuel for Points 020 and 021 when requested, violating Operating Permit 20OPWE417, Section II, Condition 6.6.",,,N,permit
1239DF2-INSP-2025.pdf,Antelope CPF 13-21,123-9DF2,16-Jul-25,May 2024,May 2025,K,"The Source failed to provide a portable monitoring test for Point 021 during the fourth quarter of 2024, violating Operating Permit 20OPWE417, Section II, Condition 6.1.2.",,,N,test
1239DF2-INSP-2025.pdf,Antelope CPF 13-21,123-9DF2,16-Jul-25,May 2024,May 2025,L,"The Source failed to limit the events associated with Activities 03, 04, and 06 for several months during the compliance period (see table below), violating Operating Permit 20OPWE417, Section II, Condition 7.4. The exceedance in event limits did not result in the exceedance of the emission limits.",,,N,permit
1239DF2-INSP-2025.pdf,Antelope CPF 13-21,123-9DF2,16-Jul-25,May 2024,May 2025,M,"The Source failed to provide the gauge pressure at actual conditions prior to each ROPE event when requested, violating Operating Permit 20OPWE417, Section II, Condition 7.6.2.",,,N,pressure monitoring
1239DF2-INSP-2025.pdf,Antelope CPF 13-21,123-9DF2,16-Jul-25,May 2024,May 2025,N,"The Source reported in the Semi-Annual Report due April 1, 2025 that vented gas from compressor blowdowns has not been routed to an ECD, violating Operating Permit 20OPWE417, Section II, Condition 7.9.",,,Y,permit
